,0,title,subreddit
t3_5m7zx4,"My fellow Democrats,

I’m /u/randomKdebater, a member of the Democratic party on /r/ModelUSGov. I’m here today to convince you to join the Model Democratic party, institute the laws you have always wanted to see be instituted, debate, and connect with a great community. 

The Model Democrats have already made some great legislative progress, such as repealing the Taft-Hartley Act, increasing the minimum wage to $15, creating a negative income tax, increasing funding for education and infrastructure. The Democrats have also spearheaded almost all environmental and green legislation, championed issues of women’s rights, minorities, legalized gay marriage, and have stood for net neutrality. However, this isn’t enough, because there is still so much left to do. 

The Model Democrats are also a great space; everyone is incredibly friendly, and excited to help out new members get accustomed to the simulation. In the community, you can debate and express your opinion, receive help from more experienced members, and try your hand at creating pieces of legislation. The Democrats also have fun weekly movie nights, questions of the week, and so much more!

Midterm elections are coming up, and the Republican party has been on the rise, doing very well in state elections and turning more and more into its real life counterpart. Not to mention, the rise of a new Nationalist/Fascist party only reinforces that these types of laws are not safe from being overturned without your help.

Whatever Party you do decide to join, we'd be glad to have you in the sim, and I hope you have a great time there as well. We would be incredibly grateful to have you join our sub and have a fantastic, and very realistic experience of government in one of the best communities on the sim!
Here is the link to join: https://www.reddit.com/r/ModelUSGov/comments/525kz7/join_a_party/
",Come and Join the Model Democrats,0
t3_5m8top,I got banned from the liberal subreddit for asking a legitimate question,Banned from subreddits,0
t3_5m04vp,,Did Trump Insult Someone Today?,0
t3_5lonlt,,"A Communist who works for Russian media is Donald Trump's ""favorite reporter""? Watch the clip. Unbelievable.",0
t3_5laqns,,Would you vote for Cory Booker in 2020? Sign the petition at bookerforpres.com,0
t3_5l4l4q,"The DNC , i was a sanders supporter who had his vote negated by the dealings of Hillarys BFF debbie. Did they really think that dishonesty would be rewarded with a vote for her? The dnc needs gutted and rebuilt from the ground up with a focus on ALL of us, not just a few groups with social issues, but all of us.","Why is everyone all finding different excuses for Hillarys loss, its one reason and its simple",0
t3_5l2giq,"Title. Sorry I don't really know more details. Can anyone back this up, is it false?","My friend said that Clinton takes all the economic credit for a bill Newt Gingrich passed, is this true?",0
t3_5juvth,,Gamal Arabi: How Muslim Liberals Can Win the Culture War with ISIS,0
t3_5jkw34,,Christmas is just days away… so here's a very special Christmas message from President Neglect Donald Trump to all of America. You're welcome. #HappyHolidaysFromDonaldTrump,0
t3_5iku0z,,Indivisible: A Practical Guide For Resisting the Trump Agenda,0
t3_5ig0q7,,Why Do Unified Republican Governments Always Lead to Crisis?,0
t3_5h37ac,,"Trump to name Scott Pruitt, Oklahoma attorney general suing EPA on climate change, to head the EPA",0
t3_5gwoan,,Total censorship. French government passes bill that bans pro-life websites.,0
t3_5ey2o1,,Nikki Haley and the New Republican “Identity” Politics,0
t3_5et934,,IMPORTANT:: Parents Of Slain DNC Staffer Ask For Help,0
t3_5esgtf,,9 things Democrats still have to be thankful for,0
t3_5eh33w,,How the Democratic Party can become a labor party again,0
t3_5e7giz,,"Senator Bernie Sanders: Let’s Rebuild our Infrastructure, Not Provide Tax Breaks to Big Corporations and Wall Street",0
t3_5djoxk,,"Deeply Flawed As A Candidate, Hillary Was The Wrong Leader At The Wrong Time",0
t3_5dejkf,,"Want to crush Trump's agenda and purge Republicans from the House, Senate, Governorates, and State Legislatures and State Senates? Then organize over at /r/BlueMidterm2018!",0
t3_5d20hv,,Will Trump Name Iraq War Propagandist John Bolton As Top US Diplomat?,0
t3_5cpz4y,In light of the recent failings we need to come together and turn things around. It is not enough to be the majority of American voices we must also be the majority of the electoral college. We need to invest in spreading education. We shouldn't be trying to build a wall across the southern border. We shouldn't be tearing ourselves apart.,Turning the Red States Blue,0
t3_5co2xn,,"Amid Trump's Smashing Victory, the Nation Elects Its First Latina Senator",0
t3_5cnej8,Can anyone post some articles about the level of protesting that Obama received when elected like what is happening right now towards Trump? Or how he alone received unfair hypo-critic criticism as a president compared to previous presidents? There was a discussion today at work where a coworker (pro trump) doesn't believe any of that happened. I appreciate any help. Thanks!,Protests under obama...,0
t3_5cg74c,,Don’t Blame Hillary Clinton,0
t3_5cckrj,,Paul Ryan Says Medicare Privatization Is On,0
t3_5cbqp7,,Millennials Are Key to the Democratic Party's Rebuidling,0
t3_5ccnpe,,The Un-United States of America,0
t3_5cbhp1,,"Republican Chairman ADMITS that ""we don't have an election anymore in California or New York""",0
t3_5c8v1c,,"So regarding 2020, I've looked at your options, and this one seems alright.",0
t3_5c84dd,,How We Lost the 2016 Election,0
t3_5c8a31,,Michael Moore’s “Morning After To-Do List” Facebook Post For Democrats Is Going Viral,0
t3_5c70bn,"Dear Grass Roots Dems,

When this all started I was on your side.  I encouraged my brother, a veteran, who was feeling very depressed, to instead get involved.  I even convinced him to come to the Dems because he supported Bernie Sanders more than Trump.  Back then, we didn't know everything we know now.  We were naive to both sides.

But then the Grass Roots Manager, Kasey Carlson, [sent him this notice via email](http://imgur.com/0UlyAdi) basically bending the rules of application to favor delegates that SHE preferred and that's when I knew, something bigger than one person being corrupt was going on.  

That is when I joined /r/CavDef and started really helping to spread the word that hundreds if not thousands of corrupted volunteers in the Dems were ruining that party from the inside out!  When California turned on Bernie and all those ballots vanished, that's when it was certain that I could no long support their party this year.  

I hope every single Democrat or former supporter of them has learned a valuable lesson that coronations are undemocratic and our country would rather vote for a strange orange celebrity with no mental filter than defy those principles.

Even trying to find the right sub to post this on is difficult because the mindset has been ""let's disable"".  Let's disable upvotes /r/Clinton!  Let's disable the whole sub /r/SandersForPresident!  Let's restrict who can submit /r/HillaryClinton!  The most undemocratic approach ever!

I just wanted you to know that you can't go through the next election with this same attitude that you can cut corners and cheat your way to the top.  Now you'll have an even harder time ahead of you though.  Maybe you'll blame her majesty Queen Clinton for her email shenanigans.  But I know that your actions for sure encouraged me to drop my usual policy this year.  I did not vote for a single Democrat because your whole inner organization is completely corrupt.  But you did encourage me to dig deeper.  To show everyone one more example like what we saw in the James O'Keefe videos.  

I want you Dems who tried to start play games with democracy to remember that your actions have consequences and for the next four years I want you to remember we could have won TOGETHER if we had just let the primaries work themselves out because no truth or untruth can lay forever undiscovered in this digital information age.  Anonymity only exists in the voting booth.  Remember that you are part of the cause and effect of this epic failure.  Because guess what?

##IT TAKES A VILLAGE.","An open letter to all grass-root democrats who cut corners, favored Clinton over Bernie, voted more than once, fixed delegates to the convention, and especially to Kasey Carlson",0
t3_5c8i1c,,The one scenario that could still get Hillary into the White House,0
t3_5c1lyr,"
Thank you wikileaks and Julianne Assange for dumping Hillary's emails. Thank you Comey for coming out a week before the election to expose Hillary.
","The DNC caused this by not going with BERNIE , once hillary was exposed by wikileaks , they should have gone with the BERN!",0
t3_5c6rws,"President Obama has told us to push him to do what we want him to do. What he needs to do now is to secure the only branch of government not yet in the hands of the republicans - the judicial branch. 

The Senate has unconstitutionally refused to work with him to appoint a new supreme court justice. Therefore he must take unilateral action. Its a long shot, but he does pay attention to the official White House petitions. Right now, its the only constructive thing I can think to do. 

You can sign the petition at:

 https://petitions.whitehouse.gov//petition/president-immediately-appoint-supreme-court-justice

 or 

https://wh.gov/ieWHl 

Full text below: 

WE THE PEOPLE ASK THE FEDERAL GOVERNMENT TO PROPOSE A NEW ADMINISTRATION POLICY: 

That the President immediately appoint a supreme Court justice 

Article II section 2 of the U.S. constitution states that the President can appoint a supreme Court justice with the advice and consent of the Senate. The Senate has explicitly refused to do its constitutional duty. It has given up the opportunity to advise and consent despite being given every opportunity and more than a reasonable amount of time to do so. Therefore, the President must take action and appoint a supreme Court justice. As the Senate has ignored its duty, the President must move forward nonetheless or else allow a defacto usurpation of executive power and an undermining of our constitution. This is the proper response to the ongoing crises created by the Senate. The questions raised by this crisis will be settled by a decision from the full nine member supreme Court.""",The President needs to appoint a supreme court justice now,0
t3_5c5umi,,How To Rebuild The Democratic Party,0
t3_5c2jsj,,Bernie or Bust,0
t3_5c3s00,She will carry on the dream that Bernie Sanders held.  Her youth and vibrancy will speak to millennials and generations y's.    ,Tulsi Gabbard 2020,0
t3_5c59w7,,Inside the Loss Clinton Saw Coming,0
t3_5c51ue,"Dear Friends,

I am deeply sadden by what transpired last night. I do not know what is next. No one does. They say ‘love trumps hate.’ Let’s prove it. Stand together. Stay together. Don’t back down.

To my friends and family who are LGBT, I am here for you and I am with you. I am a straight white male living in America; I will never kiss concrete if I don’t mean to. I will never know what oppression feels like if I don’t seek it. I am seeking it. I am standing with you. I have to do more.

We all have to do more. We cannot stand down. We cannot let this be OK. It starts with us. Each individual, and I can do more and I vouch to do more. I fell into the category of believing this country had taken gigantic steps forward, and that it wouldn’t do this. I was wrong.

I could have done more. I should have done more. We all should have done more. It’s up to us now. We have to no other choice. We lay down and we let them win. They haven’t won yet.

This is on all of us. Democrats, Republicans, Independents, and so forth. It is on the Democratic Party for pushing the candidate that we all knew didn’t create excitement, for not accepting the candidate who did create excitement and who would have won the general election.

This is on the Republicans who refused to stand up to a racist, sexist, xenophobic, who paved the way Donald Trump to rise to power. He is a fascist, a dictator with Russia on his side.

This is on the average person who didn’t pay attention to the election, who didn’t fact-check, who didn’t listen, who didn’t think this was possible, who stayed on the sidelines. This is on every one of you. This is on us, Americans.

What is our next step? I don’t know. We have to hope Trump can lead us. But he is not my president. He is not America’s president. I hope I am wrong. I am not.

We have to continue the fight. We have to fight harder. Louder. With more enthusiasm. We must not stand down, we must not let hate win, we must let democracy win out. We must go forward.

It’s hard to see today. I know that. I am struggling to see the light, too. But I am moving forward.

The fight just got tougher, but the bout has not been called. We have this. Let’s keep fighting.

Best,","Stay together, don't back down, keep fighting",0
t3_5c4g5e,,Politics Is the Solution,0
t3_5c1ont,GG EZ,A heartfelt message from a Trump supporter,0
t3_5c2srs,,Hindsight: coming in 2020.,0
t3_5c1diw,,How the Tables have turned,0
t3_5c03zy,"As crass or offensive as that may sound, this is quite literally something Trump exploited to get his nomination.",A strategic approach for next term. How to secure what is quite clearly the bellweather paranoid delusional schizophrenic vote?,0
t3_5bzkce,Noooooooo!,I don't think so,0
t3_5by4ph,,What Trump supporters sound like (Humor),0
t3_5bv0ny,,If you are (or anybody you know is) in New Hampshire...,0
t3_5bo8ai,,Dear Hillary,0
t3_5alrvt,,Hillary Clinton to join former crack-dealer Jay Z on Friday in Cleveland at Wolstein Center concert,0
t3_59pad8,,"Take a break from the rhetoric and check out ASI’s video of the top 10 wackiest political swag of 2016. Trump socks? Chia Hillary? Talking/laughing pens? Crazy, but true.",0
t3_588mer,,Zuhdi Jasser: Fighting for Victory Against Islamism: A Muslim Blueprint for the West,0
t3_581iks,,Uhhh Vote Democrat? REALLY??,0
t3_57tynn,,NC County GOP headquarters firebombed,0
t3_57a3dv,,What Are You Frightened Of? Trump With Nuclear Codes? Vote Wisely. #ImWithHer,0
t3_577p16,,Democratic officials planned to fool 'self-righteous' Sanders supporters at convention - Washington Times,0
t3_56xtv6,,"Your Federal Government, Working Against You for the Greater Good",0
t3_56xi94,,"*Pence dusts his hands off* So, that takes care of that. We good here?",0
t3_56wcz0,"On the main page of r/democrat, there is a graphic of a donkey, representing the Democratic party. This is great and all, but it raises some practical concerns. Specifically, the titles of posts tend to become unreadable when they intersect with the top half. This needs to be fixed, with all you millennials it really is disgraceful that r/republican has better web designers than you.",[META] Post titles and that giant donkey.,0
t3_56ke8x,,Forget about Trump’s “Hot Mic”: It’s Clinton in the Hot Seat,0
t3_52eq7j,,I'm back assholes. Do you really think that Hillary's health issues are still just a conspiracy? Do you think they will be a hindrance in the debates?,0
t3_51bgri,The Indiana State Senate 50th district has a unopposed republican running. I'm curious if there is anyway to file for a late ballot on the ticket if no one is currently running?,Is there any way to fill a ballot position if there is no one running for that position?,0
t3_50ablf,,WIKILEAKS Outlines How Hillary Clinton Did Bidding Of Her Saudi Masters &amp; Turned Libya Into ISIS Hellhole,0
t3_4zclpr,"Love him all you want. But if you are a Trumpkin who supported Trump because of his Muslim ban and his wall idea, you were played like a fiddle. Democrats like myself, thank you!",Thanks Trump!,0
t3_4zcjga,,Trump Plays Them Trumpkins Like Little Puppets,0
t3_4ywer1,,What's the most important policy issue you like Clinton to address if she wins?,0
t3_4ypq6k,,The Donald is Laughing All the Way to the Bank as the Sad Trumpkin's Heart is Broken,0
t3_4xw2nm,"Here in Eastern Oregon, Democrats are few and far between though the state is known for being ""blue, through and through"". The east is rural and and red. The Democrat party has seen an increase in interest in Eastern Oregon which is allowing us to be more organized, locally and regionally. A group of elected officials and Precinct Committee persons from around region have begun meeting to discuss advancing our Progressive Platform and getting Dems into local office. 
If you are interested in joining the communication, meetings, running for an office, or looking for something to do as the lonely Dem in your area... please comment and I will PM all comments in early October.",Announcing Eastern Oregon Democrat Coalition,0
t3_4xqr6o,,City run by Democrats...,0
t3_4xmprn,"Honestly. Liberals/democrats spend so much time going on about a corrupt society rigged against the poor and minorities. The battle cry is always fighting against the rich and powerful that corrupt and ruin society. But yet, we are still voting for one of the most corrupt and morally ambiguous candidates in history. I don't think I can do it. I think I'm going 3rd party.",Serious. How can we vote for such blatant corruption?,0
t3_4x97cd,"Hi all! Some friends denied climate change and asked, ""how could scientists tell what ozone and such have been like millions of years ago."" Also, ""Earth goes through phases, so isn't this just a phase?"" So what can i rebuttle with? ",Climate Change?,0
t3_4x4thy,,Does Hillary's health concern you as a democrat? There are many other videos out there showing her odd behaviors and over-exaggerative expressions leading many to believe she has had several strokes and is going downhill fast.,0
t3_4w4w3j,"This is the first of our Twitter polls. 

Out of a sample of 28 the results were the following:

* Hillary Clinton: 50%
* Donald Trump: 14%
* None of the above: 36%

[Source] (http://poachingparliament.blogspot.co.uk/2016/08/twitter-poll-1-04082016.html).

[Latest US presidential election news] (http://poachingparliament.blogspot.co.uk/search/label/US%20presidential%20election%202016).",US presidential election Twitter poll #1 (04/08/2016),0
t3_4vuvfu,,Salem witch trials 2016,0
t3_4vteai,,Fear is a liar,0
t3_4vr5su,,Why I am a Liberal,0
t3_4vr3y0,"is it out of the realm of possibility that, fearful of the possibility of losing badly, that Trump would stage a grandstand preemptive exit? today he claimed the conviction that the election was going to be rigged... would GOP rules require Pence to head the ticket? if not, what would the process be to replace him?",what if Trump were to withdraw?,0
t3_4vpcy8,,Is it a coincidence that the same people that deny Donald is dangerous also deny climate change?,0
t3_4vmqcb,,Why Donald Trump Has Already Lost The Election,0
t3_4vlihk,,Just Found the Perfect Anti-Trump Hat,0
t3_4vhh22,,What is Obama’s Legacy?,0
t3_4ve1vv,,"How come all Trump supporters are not racist, but all racists support Trump?",0
t3_4vdoyz,,BFFs,0
t3_4vcv30,,"""How was I to know, he was with the Russians too?""",0
t3_4v38zk,,"""Trump as well as Clinton are in the race for the American presidency for nothing more than the glory of winning the seat.""",0
t3_4ukn2t,,5 Reasons Hillary Clinton is Bad for Woman,0
t3_4ubk4u,,DNC Committee Rejects Amendments to Eliminate Superdelegates After Locking Sanders Delegates Out of the Room,0
t3_4ublk6,,DNC Chair’s PAC Has Paid More in Salaries Than It Has Given to Democrats,0
t3_4u9xa0,"Can anyone confirm this? I can't find it anywhere else yet.

I apologize for the fb link

https://www.facebook.com/PeopleForBernie/videos/1831628477057358/
","I just saw on fb that ""Bernie Sanders supporters, including delegates, are locked out of the DNC rules committee AND have been kicked out of the building.""",0
t3_4u47n1,,Wasn’t so long ago… (x-post /r/bald),0
t3_4u3uq5,,Kaine leads as Democrat Clinton nears a running mate choice,0
t3_4trsro,,Everyone is entitled to their own opinions. What they are not entitled to is their own facts.,0
t3_4tmsjs,,Republican Convention 2016 (by Bruce Peeples),0
t3_4t6r3c,,Mike Pence is Arguably the Most Evil Politician in America,0
t3_4s6660,"Why on earth did Hillary's delegates vote for tpp and fracking? Isn't that like, a Republican thing to do (even though trump is scrapping tpp). Totally shooting herself in the foot.

Also I was there, it was supposed to start at 3 pm, people spoke at 4:30 til 7, 7-9 pm memorial, and the voting actually started at 11 pm-2 am. Same kind of bad scheduling the next day extended the bloody thing until today (sunday).

The hell Debbie",DemPlatform???,0
t3_4s3655,,"Trump's ""Latino Strategy"" Still Centers on White Voters",0
t3_4rfg96,"The 1994 Crime bill was not strictly about incarceration. Also included in the $30 billion were funds aimed at crime prevention: community policing, drug treatment and so-called “midnight basketball” leagues to help keep teens out of trouble. Clinton’s efforts to soften the Senate version and include prevention programs won support for the bill from several members of the Congressional Black Caucus. The caucus chairman said at the end of the process, “We have put our stamp on this bill.”The landmark Violence Against Women Act was established in that bill, which has helped reduce domestic violence by two-thirds, a steeper drop than the overall decline in violent crime. And the bill included an assault weapons ban, although congressional Republicans refused to renew it a decade later.But the president also had to appease Republicans to compensate for lost Democratic votes. He maintained the crack and powder cocaine disparity (Clinton pushed for reducing the disparity in his second term but got nowhere with the Republican Congress). And he tied funds for state prison construction to the removal of state judicial discretion on sentencing http://www.realclearpolitics.com/articles/2016/02/22/dont_punish_clinton_sanders_for_1994_crime_bill_129729.html",The 1994 Crime bill was not strictly about incarceration. Also included in the $30 billion were funds aimed at crime prevention,0
t3_4plbed,,I made a fire domino symbolizing Donald Trollump laying waste to the USA. :),0
t3_4pafe1,,Primaries as of June 20th,0
t3_4oprpq,,"There's definitely been an increase in mass shootings since 2011, is it related to record gun sales in 2010-2012?",0
t3_4og5zp,,POLL: Hillary's VP top 10,0
t3_4nga6c,,why does hillary not make bernie her vice president choice?,0
t3_4ncei9,,Freedom.,0
t3_4n19h0,,media blackout,0
t3_4m0ops,,"Many lefties have joined the reddit r/DemocratsUnbiased, because r/Democrats is so biased and conservative. Why don't each of you join too?",0
t3_4lj36x,,Democratic Primaries as of May 27th,0
t3_4lh2jl,,USA 2016,0
t3_4lfq45,,Democrats are coming up with a different way to challenge Trump's 'manhood',0
t3_4l3hb8,,Huffington Post: DePaul Admins Told Police Not To Do Their Jobs,0
t3_4kz82q,,#ShutTheTrumpUp,0
t3_4k9735,,Sanders camp slams Debbie Wasserman Schultz for 'throwing shade',0
t3_4k3nxn,,george carlin on republicans,0
t3_4k14xi,,Who's voting in the Democratic primaries?,0
t3_4ju209,,"Mark Cuban: ‘Huge, huge’ losses for stocks if Trump wins",0
t3_4joytn,,Why Donald Trump’s Tax Returns Matter,0
t3_4jjtvx,,friendly fire?,0
t3_4ipcl8,"Its like they have no heart, they think bush wast bad, that trumps the best thing ever and that giving a cent to the disenfranchised is what caused our debt, when we barely give to them at all. ",Dont know where to put this but how do you deal with republicans that wont listen to reason,0
t3_4iem8u,When the hell did CNN start almost exclusively broadcasting Donald Trump? No wonder Bernnie Sanders doesnt have a chance. What can we do as average Americans!?,CNN is FOX 2.0,0
t3_4i42sn,NSFW welcome,"Fellow Dems, let's share our favorite pictures of Hillary Clinton",0
t3_4i0gbb,,Why the media will lift Trump up and tear Clinton down,0
t3_4hn0u1,"Hey I am from the UK and a fellow lefty. I have created a small app which is extremely addictive, fun and hard. The game is very simple and tests your reaction skills to the max. Please please try and give it a five star rating on the store if you can, I would appreciate this immensely. Down with Trump.

iOS Link - https://itunes.apple.com/us/app/stump-the-trump-game/id1104788903?ls=1&amp;mt=8Pl

Android Link - https://play.google.com/apps/publish/?dev_acc=03092762000097854873#MarketListingPlace:p=com.JackEvans.StumpTheTrump",I have created an Anti-Trump Game which is great!,0
t3_4h6q1i,,Found this outside my house. I'll take this as a compliment. Good to be reminded that our hard work pays off.,0
t3_4ghj70,"I am a first time voter from Maryland. I registered democrat when I signed up for selective service. My brother looked me up and I was unaffiliated. I don't understand, why??? Thank you.",Voter question,0
t3_4f8hyr,,(TEDTalk) A Conservatives Plea: Let's Work Together,0
t3_4enrlj,,Funding Education Through Satire,0
t3_4dtrge,"Hey everyone, I am doing a project on political literacy, and we need a survey with a lot of responses. It will only take a minute or two. I figured this would be a decent place to ask for it. And before you say anything I know the questions are basic and simple, but it's all we need. Also, sometimes the survey will repeat itself, so if it does that just skip the repeated questions. Thank you for participating, here's the link:
http://www.surveygizmo.com/s3/2668373/political-literacy",Help My Survey,0
t3_4dqgl9,,"Libor trial: ex-Barclays staff earned big bonuses, court hears | Business | The Guardian",0
t3_4cthro,,Alan Grayson Wants Bernie Sanders Supporters Not To Worry,0
