,0,title,subreddit
t3_6tgzma,"The property tax is a community tax. The community pays tax on property into school budgets and City Council general funds. Property tax is a community tax.

If property can/is an investment. And increased property values is the purpose. The property tax can be used as an investment tax, not a community tax.

If Citizen A lives in an apartment an his neighborhood's property tax increased 25% in 4 years. Citizen A's purchasing power has decreased.

If Citizen B buys and remodels a home next to an apartment complex. Over 4 years his property taxes have increased 25%. Citizen B's home value has increased 65%. Citizen B has increased their portfolio.

If Citizen B sells stock and puts it in their savings account. Citizen B is assessed stock sale/investment tax at year end.

If Citizen A takes $200 from pay check and deposits it in savings while standing at the window next to citizen B. Citizen A is not assessed stock sale tax.

If property is an investment and property is not an investment. And the City Council/County Government can raise property values as part of their duties. City can have a happy, wealthy, person and a larger budget if they raise property values. Then property is not a proper investment. It is fraudulent.

Then, the County/City can raise property values to help reassess their citizens portfolio. Which also helps their budget. Property is an investment. Property is a portfolio.

The City/County raise property values to help/reassess their citizens portfolio. Which helps the city's budget. A community renter can not afford to stay, and moves. Which helps the citizen's portfolio. Which helps the city's budget.

The City/County raise property values to help/reassess their citizens portfolio. Which helps the city's budget. A community renter can not afford to stay, and moves. Which helps the citizen's portfolio. Which helps the city's budget. A 30 year homeowner is on a fixed income and can not afford to stay. Homeowner sells house. House is turned into high end duplex. Which helps the citizens portfolio. Which helps the city's budget.

The City/County raise property values to help/reassess their citizens portfolio. Which helps the city's budget. A community renter can not afford to stay, and moves. Which helps the citizen's portfolio. Which helps the city's budget. A 30 year homeowner is on a fixed income and can not afford to stay. Homeowner sells house. House is turned into high end duplex. Which helps the citizens portfolio. Which helps the city's budget. 20 renters and 9 homeowners can't afford to stay and movie. Properties are town down and luxury apartments are build. Which helps the citizen's portfolio. Which helps the city's budget.

Property is an investment. Property is not an investment. Property tax pays for school and budget and city general fund. Property tax is a community tax, so what happened to the community?

Citizen A has a well funded investment account. Politician A can raise/lower dollar amount on Citizen A's investment account. Politician A tells citizen A that he can raise investment account 15% every year. Which will help his budget. If Citizen A agrees, Politician A will lower % from 4% to 3.5% in 2 years, 3.5% to 3% in 4 years, 3% to 2.5% in 6 years, and 2.5% to 2% in 8 years.

That's fraud.

If property is an investment.

City/county benefit from return on investment

If property is a portfolio

City/County do assess worth of portfolio

If property value reflects on City/County budget

City/Count will increase portfolio's value

If property value is increased by high value structure

City/County duty is to approve structures. Structures will always be approved

If property is an investment. But, the property tax is a community tax. Then City/County are required to exercise prudence. IF the property tax has been used to enrich investors and defraud the community. The city/county have acted illegally.

If property is an investment and the city/county have improperly applied a community tax as an investment tax. Exponentially rising costs will eventually remove the community. If, the city/county duty's include – property value assessment – and approval of new construction. And their community is only investors. Then it is not a community, it is a portfolio. And if the community is a portfolio. Then the City/County are not a government, they are investment managers. If investment community can force/coerce/vote added value to their portfolio. It is a criminal operation.

If Sky-scrappers and mega-structures add value. And a large American city has had a demographic shift and growth over 12 years. And the City/County has been using the property tax as an investment tax. Cost of living will go through the roof. If the City/County requests state/federal aid or funding for section 8 housing to house what were formerly housed citizens. Then that is a racket.

If the City/county – in the face of this – approve a new high value structure to increase ROI for community investors. The city/county is openly acting against the non-investor. If this is to continue – then the progressive/mega-city growth will continue – as the community-as-an-investment's children will have to always move to settle.

If property is an investment and property is not an investment. And the investor has minimal effect in overall quality of life of the investor. But the investor can drastically effect the quality of life and world of the non-investor. And the investor has a choice of living arraignments and the non-investor does not. Then the community needs to be planned around the non-investor.

The property tax is not an investment tax. The property tax is a community tax. If property is taxed, not because it is property, but because of its physical location within a community. Then the overall reason for owning property, investment or non-investment, should not be taken into consideration when applying the tax. If it has? If two decades of defrauding the community to enrich investors – causing untold damage to the American Public – resulted in any personal wealth or kickbacks to the City/County then they need to be held accountable. If a government refuses to hold themselves accountable. Then surrounding communities, cities, and counties, effected need to sue to force a cessation of mega-projects until all infrastructure upgrades have been planned for and completed and all necessary arrangements for displaced members of the community have been met. ",What's going on with the property tax? Is it a community tax or an investment tax?,0
t3_6ta1d7,,Why ad-libbing on North Korea makes the US look weaker,0
t3_6t8duo,,Discrepancies emerge in Jane Sanders' Burlington College donor list,0
t3_6t7bip,,Trump seems to lock Democrats out of Federal Judge picks….,0
t3_6ss3vw,,Eighth Circuit: Citizens do not have a right to film public officials in public,0
t3_6srzp9,,Judge orders new searches for Clinton Benghazi emails,0
t3_6snu8t,,New video from DKO: What the Democratic Party NEEDS to do,0
t3_6rqg95,,3 San Francisco city officials may face trial on corruption charges,0
t3_6rooub,,Poll: Majority Of Americans Don't Like Black Lives Matter,0
t3_6rpfjw,,"Liz Warren Says Trump Waging ‘All-Out Assault On US Workers.’ A Day Later, Unemployment Hits 16-Year Low",0
t3_6rofkr,,Radioactive: Democrats Are Starting To See Nancy Pelosi as A Cancer,0
t3_6rj4nt,,"Starting Tonight, GOP Will Have Full Control of 26 States",0
t3_6rhm0j,,DREAMer accused of brutally raping woman in Seattle suburb,0
t3_6qbj5c,,Are you feeling guilty about missing that last protest? Here's a video to cheer you up ;),0
t3_6q0725,,"EU close to making Facebook, YouTube, and Twitter block hate speech videos",0
t3_6pxd0v,,Democrat victorious in New Hampshire State Senate special election,0
t3_6oz6nk,,What would you ditch to keep or get rid of President Trump,0
t3_6okxjj,,I wish President Trump would...,0
t3_6o3r9b,,ARE YOU TIRED OF WINNING YET?,0
t3_6mvdsb,,"The ""Better Deal"" Is A Turning Point For The Democratic Party",0
t3_6mw6wh,,John Cleese vs Extremism,0
t3_6m2xik,,"'Oh my God, it is Obama': Alaska mom, baby meet ex-president",0
t3_6lhsk6,,City worker and Democratic organizer busted for child porn,0
t3_6huq81,"Hello fellow Democrats,

Might I interest you in Reddit’s own Model US Government? In /r/ModelUSGov, we have an active Federal government with a House of Representatives, Senate, President, Supreme Court, as well as an active state government encompassing six states (all six are made up of the US's real states) each with a governor, assembly, and court system. In Model US Gov we have many members who propose bills, debate, run for office, and interact with a large community of individuals.

We would like you, a member of a movement dedicated to fighting far-right extremism, bigotry, racism, and hatred to help us do the same within our small community. The Democrats have uniquely passed legislation in order to better the lives of Americans by passing a $15 Minimum Wage, Universal Healthcare, gun-control legislation, criminal justice reform and the elimination of private prisons, environmental legislation, and much more. However, there’s still more to do, and we need your help to prevent the growing alt-right and anarcho-capitlaists from overturning much of the progress we’ve achieved. 

If you would like to join a great community, and participate in a fun and fairly accurate simulation of government politics, be sure to join us on this [thread](https://www.reddit.com/r/ModelUSGov/comments/5ymhfb/join_a_party/) and ask to join the Democrats. 

Thanks, and we hope to see you there!",Join the Democrats on Model US Gov!,0
t3_6hmn7c,,Trump on twitter with Cofefe,0
t3_6fgg8d,,Covfefe,0
t3_6ezup6,,Trumps 15 most Baffling tweets,0
t3_6eeu9i,,Bernie Delegate Pellegrino Wins BIG In Trumpland,0
t3_6du2iu,https://wattsupwiththat.com/2017/05/24/renounce-climate-alarmism/?republicans,"""Climate alarmists"" is a new term for those in the ""cult"" of climate change.",0
t3_6dtkm0,,"So, this is what passes for news lately? No wonder CNN is tanking.",0
t3_6ccj7l,,26 Year Old H.S. Teacher Wins Primary Against Democratic PA. Mayor Who Backed Trump.,0
t3_6bxy4w,"https://www.youtube.com/watch?v=ZjgCwXDo4Ac

That is, Muslim pedophilia and violence?","Democrats, you support this?",0
t3_6bx939,"I knew it was bad, but not THIS bad:

https://www.youtube.com/watch?v=q2jijuj1ysw

Glad I saw this. More people need to know.",WOW! Never realized universal healthcare was THIS bad,0
t3_6brgtt,"I thought all of you pussy snowflakes were moving to Canada, please, do. We don't want you here so why are you staying, just move to Canada like you said and everyone will be happy.",Serious Question!,0
t3_6bmilj,,Cenk DESTROYS Politico After Latest Bernie Smear,0
t3_6bgj3d,,Get ready for recess,0
t3_6b2lp1,,Report: sealed indictment issued against Donald Trump,0
t3_69xj3e,,RESIST: Nearly 1 Million Join Movement to Strip Congress of Their Healthcare. Do You Support Them?,0
t3_69rghr,,The Resistance Gave Birth To A Girl And Her Name Is Hannah Risheq,0
t3_69i47f,,Priebus: Trump Considering Amending or Abolishing 1st Amendment,0
t3_69fkhw,"Here is a start: GOP = Gouge Other People

Any other suggestions?",What does the GOP stand for?,0
t3_69aqvh,"Hello fellow Democrats Supporters,

Might I interest you in Reddit’s own Model US Government? In /r/ModelUSGov, we have an active Federal government with a House of Representatives, Senate, President, Supreme Court, as well as an active state government encompassing six states (all six are made up of the US's real states) each with a governor, assembly, and court system. In Model US Gov we have many members who propose bills, debate, run for office, and interact with a large community of individuals.

We are currently in the middle of a Federal Election, and the Democrats are facing a tough reelection from Republicans and Libertarians. The Republicans have fielded a presidential candidate who very much resembles Donald Trump in his rhetoric and policy stances. Candidate /u/Viktard has been shown to be vehemently against abortion, universal healthcare, and has been proven to be a puppet for the extremists in his own party. On top of their presidential candidate, the GOP have also provided the alt-right an avenue to take down our Democracy. This is the time for people like you to join in the fight against the right! The Democrats are currently working with the Socialists, who have supported very moderate Incumbent /u/Bigg-Boss for reelection to the Presidency.

If you would like to help our cause, here’s how, and it will only take a few seconds:

1. Follow this link: https://musgov.melect.net/login

2. Follow all the directions. If you are asked to chose which state in which to vote, you are free to chose any irl state. The Democrats are running in The West, The East, the Northeast, and Central States. The map can be found [here](http://i.imgur.com/hnvHrVc.png) of where the irl states are corresponding to our in-sim states.  


3. Vote for the /u/Bigg-Boss(Socialist)/ /u/Aoimushi (Green-Left) presidential ticket, and vote for Democrats down the ballot (if no democrats are in the state you pick, choose our allies the Socialists or Green-Leftists).

Thank you for your help, and may Democracy stand strong against those who seek to destroy it.

ZeroOverZero101, Democratic Senate Candidate for the East",Support the Model Democrats against the GOP and Libertarians!,0
t3_69247a,,Nancy Pelosi Facing a Progressive Bernie-Esque Primary Challenger: Steph...,0
t3_68sm67,,The mainstream media is trying very hard to bury this massive lawsuit against the DNC for sabotaging Bernie Sanders,0
t3_68od9l,,Friend just announced his candidacy for NJ-7,0
t3_67ylli,,Progressive Congresman Challenges Own Party On Corporate Cash &amp;amp; S-Y-R-I-A (Ro Khanna),0
t3_67kvac,,"Bye bye, Bernie: He’s not fit to captain the Democratic ship if he can’t stop chasing the great white male",0
t3_66l3j7,,[Academic] Partisanship Survey,0
t3_664a6i,,"Kim Weaver, planning to run for Iowa's 4th district against Steve King, worked as internet psychic",0
t3_65b347,,The Most Powerful Message You Will Watch Today,0
t3_64qzqk,,ELECTION DAY: Latest polls put Democrat James Thompson WITHIN 1%--last chance to phonebank and get out the vote starts NOW,0
t3_64bk7c,,"Tread Carefully In Syria, Mr. President",0
t3_63ozhr,"Can someone help me? why is it that that most liberals and media currently oppose the nuclear option. In 2013 the democratic party had a slight majority in the senate, they activated the nuclear option to help confirm three of Obama's picks for the court of appeals. that is the only time that it has ever been used was by democrats. What makes it ok for one party to do something but when one republican brings up the idea it upsets all the democrats? ",The Nuclear Option,0
t3_63ekwh,What are your thoughts on Soros? The globalist agenda? Funding provided to antifa and blm for the sake of destabilization? The sjw's trying to kill free speech?  ,Serious questions for the Left.,0
t3_62qrzp,,Single Payer Bernie Sanders Nancy Pelosi Don Beyer and the Defensive Democrats,0
t3_62hkat,,"The 265 members of Congress who sold you out to ISPs, and how much it cost to buy them",0
t3_62dsg2,,Dump Trump!,0
t3_62bps6,"I was livid over Republicans' treatment of Garland (or rather Obama): http://to-the-editor.livejournal.com/tag/courts
But found something that made me rethink:
 http://www.nytimes.com/1992/09/01/us/waiting-for-clinton-democrats-hold-up-court-confirmations.html
""Waiting for Clinton, Democrats Hold Up Court Confirmations"" (New York Times, September 1, 1992)

It shows, sadly, that Democrats weren't above doing what Republicans did.  And yes, it's not with the Supreme Court, but the one just below (headed now by Merrick Garland).
E.g. John Roberts (current Chief Justice) was nominated in May1992, but never given a hearing -- to let Bill Clinton fill the seat, which he did.
If Garland's seat was stolen, then so was Roberts'.  It's one thing to be morally against theft; it's quite another to say ""yeah we stole
your silver, but how dare you steal our gold?!""

And while there's no ""Biden rule"", his 06-25-1992 speech ( https://www.grassley.senate.gov/sites/default/files/judiciary/upload/SCOTUS%2C%2003-24-16%2C%201992%20Biden%20Speech.pdf ) matters.  Why did he make it at that time, with no vacancy?  He heard that a Justice
might retire, and made his speech to preserve the vacancy for Bill
Clinton to fill.  In his speech, he says ""that would not be our
intention"".  But in light of Biden's effort at the time to preserve
court seats for Bill Clinton, most likely Biden was doing the same
with the SCOTUS seat he believed was opening up.  So he was pursuing raw partisan ends, but covering them with high-minded rhetoric -- exactly what made me livid about Republicans' stance.

And speech isn't action.  But the stalling of Bush court picks to save the seats for Bill Clinton was action, and Biden's speech was part of that action.

Are there still important distinctions that I am missing?",rethinking my outrage over Garland,0
t3_627rb8,"MSM reported this spying on Trump and his Team in January 2017. This illegal surveillance was conducted under some extremely flimsy grounds related to a clearly debunked report created by a political hack who was paid for his blatantly false efforts. 

Besides directed evidence of Obama Whitehouse, FBI and DOJ breaking law from Nunes comes this sweetie coughing up everyone like a wet slimy fur ball. And what's best is this pussycat is so stupid and hungry for the spotlight she did not even realize the revelations of her statements at the time she made them. 

http://www.thegatewaypundit.com/2017/03/obamas-former-asst-defense-secretary-admits-obama-admin-collected-intel-trump-video/",Guilty as Charged,0
t3_623ysy,,The Vitriol That Is American Politics,0
t3_61k2fj,,Turkey's Foreign Minister Mevlüt Çavuşoğlu met with both Michael Flynn AND Devin Nunes during Trump's nomination of Flynn for National Security Adviser while Flynn was a Foreign Agent for Turkey. Nunes is heading the House Intelligence Committee 'investigation' into these intertwinings.,0
t3_619xld,,"The Idiot President - a satirical @POTUS simulator, 100% FREE on iOS",0
t3_61530u,,Silence U Part 2: What Has Yale Become? | We the Internet Documentary,0
t3_612pi8,,"Awesome new Elizabeth Warren ""Persist"" t-shirts available now!",0
t3_5ztaij,Bernie only paid 13.5 percent they say,How should I respond when Trumpettes say that Trump paid more taxes than Bernie?,0
t3_5yo9rt,,How to Protest: Do's and Don'ts for your next Political Rally,0
t3_5yart3,,House Democrats identify vulnerable incumbents for 2018 cycle,0
t3_5y3ozt,,Ben Carson is delusional. He really needs to #wakeup Get out inspired.,0
t3_5xtjhz,,Democrats Now Demonize the Same Russia Policies that Obama Long Championed,0
t3_5xhkqz,,Democratic Response by Former Kentucky Governor Steve Beshear,0
t3_5wapj7,,"Be clear about what happened to Keith Ellison | The establishment wing has made it very clear that they will do anything and everything to hold down the left faction, even as they rather hilariously ask the left faction to look above their differences and unify in these trying times.",0
t3_5v0ke1,"I've started a new initiative to make a firm statement of support, peace, love, and respect for the Muslim American community and raise money for Refugees!

[We Love Muslims and We Love You](https://www.facebook.com/WLMWLY/?pnref=story)

I appreciate any support! I'm going to be spreading this message as far as I can.",I started a movement in support of Muslim Americans and to raise funds for refugees,0
t3_5ux9dx,,Correspondence from Socialist Canada — Week 4: Canada's Trump vs. Canada's Obama,0
t3_5uf0ab,"Good Morning!

I have been trying to get an answer to this question, but not sure which subreddit to post it to. Upfront, I am not a Democrat or a Republican, I consider myself Libertarian. 

My question...The emails that were leaked by Wikileaks, and hacked by the Russians. Democrats have gone out of their way to say that the Russians attempted to influence our election by the hacking of the DNC and Podesta. But they have never spoken to the veracity of the information that was leaked, detailing corruption and collusion throughout the DNC. Why is it more important to say that Russian interference was a bigger deal, than talking about and confronting the corruption that was highlighted in the emails? Does it not matter that the people running the party are doing everything they can to lie to their party members in order to keep power? Please I want to understand this.",Question about the election,0
t3_5tcj60,,Correspondence from Socialist Canada - Week 3: Inside the Other Side of Healthcare,0
t3_5sh04t,,"2016 Elections: The tortoise and the hare - ""Just as with the 2016 election, the Clinton team was over confident and did not visit nor bother appealing to necessary constituencies within the Democratic Party.""",0
t3_5s37fy,,Sam Ronan for DNC chair,0
t3_5rxm7o,,Correspondence from Socialist Canada - Week Two: Legal Weed and Socialist Police,0
t3_5rr510,,De Vos moved up from Monday to Friday 6:30 am,0
t3_5rp289,,The Tyranny in Trump’s Cabinet,0
t3_5r5hwa,,American Espionage: Correspondence from Socialist Canada,0
t3_5r0nlu,Other than 'fuck you Trump for ruining my much needed vacation' and 'I tried to warn you fools' what do you think Obama is thinking right now?,What is Obama thinking right now?,0
t3_5qnksu,,"My greatest fear is that by abandoning those who we encouraged to fight, in Syria, we have driven them right into the open arms of ISIS.",0
t3_5qjqgc,,Trevor Noah Fan Site,0
t3_5pwn23,"First time here so I'm sorry if this question has already been asked hundred times. 

Seeing Trump take the oath and seeing him sit in Obama's seat makes me sick to my stomach. I am already obsessed with the need to replace him. ",Who should run in 2020?,0
t3_5pdnpf,,Standing up for what's right!,0
t3_5pag8b,"If, and only if, the following conditions are met, and matched by the LGBT community, and other Democrats, I, ____________________, Do so solemnly swear,  that if the forthcoming conditions and compromises are met, to vote at the local, state and federal levels, for the Democratic incumbents in each forthcoming election for the rest of my life, but only after the forthcoming conditions and compromises receive 50,000,000 Ayes in response to this reddit. 

• Conditions
   
     • You, as a member of the Democratic party/LGBT community, swear to vote Against Gun Control, in any form, including but not limited to: 

limiting Veterans from owning or possessing firearms; 

limiting or forbidding non-veterans/non law enforcement from owning firearms;

Doing away with mandatory firearms registration, and replacing it with voluntary registration;

Maximizing funding for free firearms safety classes (all ages); 

Allowing for total open carry by trained individuals of all ages, race, gender and orientation; 


Allow for ""gun culture"" to become as natural as breathing air once again;

Push for inalienable legislation protecting the Second Amendment Against Repeal/Replace legislation;

Push for inalienable legislation protecting the 4th Amendment concerning the 2nd Amendment;

Push for inalienable interpretation of the 2nd Amendment standing to mean every individual citizen of the United States of America has a right to bear arms, inside or outside of law enforcement, or the military, with no consequence unless their actions caused, intentionally, the death of 1 or more persons, with no immediately justifiable reason, justifiable reason reason explained in this case 

 • protection of others around you in a firefight that was not caused by nor started by the living subject, 

• protection of home and hearth, and rightfully notarized property/pets/livestock

• protection of your neighbors and their property/pets/livestock,

• protection of military or law enforcement officials; 

• Protection of postal carrier

      • You, as a member of the Democratic party/LGBT community, swear to uphold the Bill of Rights, Archaic yet Wise, with no attempt to misinterpret any of these 10 Amendments in anyway other than as stated here;

      • You, as a member of the Democratic party/LGBT community, swear to avoid taking away the rights of others.


       •You, as a member of the Democratic party/LGBT community, Solemnly swear never to impose a tax (fine) on income tax returns,or other tax returns, for any reason at all, ever again.




• Compromises

   • LGBT has full equality to non LGBT
   
   • A woman's body is her own. 

   • Women have equal pay for equal work done,
       Paid sick days during menstruation/menopause, 
      And access to healthcare with no luxury tax on feminine products.

     • LGBT community has access to health care with no hassle 

     • pre-existing conditions do not affect your insurance 

     • Corporations are not a person and have no place in politics, nor voting rights as a singular US Citizen.



In Summary, 

You get what you want, I get what I want, vice versa.

After 50,000,000 Ayes, to the terms conditions and compromises of this eDocument, I, ____________ do solemnly swear to uphold my promise of voting straight ticket Democrat until death or senility take me.
",180° Turn Around.,0
t3_5oy15r,,45th president,0
t3_5nl3vf,,Cory Booker and 12 Other Dems Just Stopped Bernie Sanders’ Amendment to Lower Prescription Drug Costs,0
