,0,title,subreddit
t3_7qho83,,Clinton Guard Says He’ll Go Public on Clinton’s 26 Underage “Lolita Express” Trips,0
t3_7qgfld,,New CF Investigations Launched,0
t3_7qhlpk,,Cotton: Durbin 'Has a History' of Misrepresenting What Happens in WH Meetings,0
t3_7qhjvv,,Ambassador to the commoner,0
t3_7qhjkp,,"President settles $850,000 sexual assault lawsuit",0
t3_7qhxqw,,Stop defending communism,0
t3_7qhxk0,,"Donald Trump's Support Among Blacks Has Doubled Since 2016, Despite Endless Racism Claims: No Wonder, Blacks Doing Better Than Ever",0
t3_7qhqnn,,"MSNBC Host Cuts off GOPer After She Brings Up Clinton Murders: “You can ask Klaus Eberwein, the former Haitian government official that has all the dirt on the Clinton Foundation– oh, wait, you can’t ask him because he mysteriously committed suicide the day he was supposed to testify”",0
t3_7qhqew,,"Paid a fortune to join a ""whites only"" country club in the 90s. Tells black people she carries hot sauce in her purse. Calls black people ""super predators"". Not racist, according to the propagandist MSM.",0
t3_7qeq23,,White House releases audio proving that journalist purposefully misquoted him.,0
t3_7qhegt,,We sure dodged a bullet with this one didn't we folks?,0
t3_7qf7q7,,Loretta Lynch Implicated In Uranium One Obstruction Of Justice,0
t3_7qa6nc,,Bill Clinton Says Haiti Relief Funds Didn't Pay for Chelsea's Wedding… Then Wikileaks Dropped This Bomb,0
t3_7qa3gg,,"Interesting Uranium One email: Did the US approve shipping 47,200,000 kg of uranium to process in Russia?",0
t3_7q7h5n,,First Uranium One Indictment Unsealed,0
t3_7pznh9,,Candidate for Illinois attorney general robbed at gunpoint in Chicago,0
t3_7q1pgg,,Establishment Democrats Are As Authoritarian As Trump,0
t3_7pkcxt,"I had a ""discussion"" with a young fellow and this was his conclusion:

""You liberals just don't get it do you?

So first off, It is the democrats that do not care about the poor or lower middle class. The Democrats want these people on food stamps, welfare, and other subsidies because it is a way to control them. The Dem's use these payouts as chains and they have put this class of people into a new type of slavery. If you like being a slave vote for the Democrat way. High taxes cause business to hold back paying the people or they just move out. The keystone pipeline is GOOD for the environment unless you like it being transported on trucks that LEAK all over the place and are environmentally unfriendly. The child care issue you speak about Congress failed on that one not Trump. Over regulation KILLS business and innovation. This video has so many inaccuracies it is obvious it was not thought out and the whole picture was not looked at. Just look at CUBA- that organization was killing its people and abusing them. The Cuban people are suffering why on earth would we support that? Look at what Cuba was doing to our diplomats. You better open your eyes and start looking at the whole picture since it is obvious you have been brain washed and you believe the main stream media and not thinking about whats best for the US. Even your Isreal comments about Jerusalem Congress under Obama voted FOR the move and it has been suggested for 15 years but Trump finally said Do it.﻿""",Damn democrats ruining murica!,0
t3_7pbei2,,New York Dem charged with stealing Sandy money from FEMA,0
t3_7onbh5,,Michigan dairy farmer gets prison time for hiring undocumented immigrants,0
t3_7omesd,,The real collusion has been located.,0
t3_7oa64b,,Crime Victim Dad Fights California State Sanctuary for Illegal Aliens,0
t3_7o7chi,,"ABC News’ mistake-prone Brian Ross doesn’t return from suspension as planned after botching report on Trump, Russia",0
t3_7nxsog,,Stunning Photos Reveal Progressive Leaders Flashing ‘White Power’ Sign,0
t3_7npu1m,,DACA Recipients Not So DREAMy After All,0
t3_7noctb,,"Prank California highway signs 'welcome' felons, illegal immigrants and MS-13",0
t3_7ngr08,,"Just wanted to put this here, ban me if you want",0
t3_7mxgfz,,Key races for control of the House as Democrats take slight edge into 2018,0
t3_7mi0k7,,"In California, harassment scandals roil ruling Democrats",0
t3_7lwtil,,"Goodbye, capitalism. Hello, oligarchy.",0
t3_7ln2pz,,If Libs Were Smart They Would Push For Mueller Firing Himself Now,0
t3_7ldego,,It's Official: Trump Now Has Greatest Stock Market Rally in History! Dow Breaks 70th New All-Time High in '17 – Most Ever in One Year!,0
t3_7kxnvd,,"After being registered as an Independent in Louisiana for 15 years, I used moving to Portland as an opportunity to finally make the leap. Can’t wait for midterms! (Sorry about photo quality.)",0
t3_7l4upc,,Accurate Headline: Every Democrat in Congress Just Voted AGAINST Pro-Growth Middle Class Tax Cuts,0
t3_7ky1z3,,Democratic Senators Urge Al Franken To Reconsider Resignation | Morning ...,0
t3_7kpqkd,"Context aside, I think Comey should have been fired and Trump's ""official"" reasons for doing so were completely legitimate. (His real reasons are another story, but that's not what I'm getting into right now.)

He really did put his finger on the scale, twice, to hurt Clinton's chances. He really did make public an investigation that was meant to stay private. He really did shout from his position about how Clinton was ""extremely careless."" In his biased opinion.

Simultaneously, he kept his mouth shut about Trump.

I know we're not supposed to talk about all of that now, but still...

Does anyone else still hate him?

Edit: Huh, there is actually someone else who shares more blame here. Go figure.",I'm still mad at fbi director Comey,0
t3_7kntnd,http://nymag.com/daily/intelligencer/2014/02/i-crashed-a-wall-street-secret-society.html,Literally shaking,0
t3_7kgmm9,,"Rep Speier (D-CA): Rumor is Trump could fire Mueller this Friday, December 22",0
t3_7kbvwk,,Recount of the Alabama Senate Race is ON. Multiple levels of election fraud being uncovered.,0
t3_7k5suf,,"Judge Roy Moore raising $75,000 to pay for recount in Alabama",0
t3_7k48cy,,Trump District Judge Nominee has nearly no practical law experience.,0
t3_7jwlbb,,"Machine glitch, ballot confusion cause snags on election day",0
t3_7jjshj,,Ex-GOP governor stuns with call for Franken to keep job after âabsence of anything resembling due processâ,0
t3_7jg27s,,Live Alabama Election Results: Roy Moore and Doug Jones Compete for Senate Seat,0
t3_7ixjzg,,"It doesn’t matter how you do it, but please please please get involved in your local, state, or federal government.",0
t3_7ixj8a,"I know that Democrats are scared of the light because they are pro-abortion, but everyone has sins. I have many sins, which is why I joined the army today. My pastor says we need to protect Jerusalem from false prophets in Jerusalem. I think that if I serve our country in this time I can be forgiven. Why do Democrats not think this? ",Why is Democrats so against King of kings? Are you not ready for New Jerusalem?,0
t3_7i1p1d,,Democrats line up to call for Al Franken's resignation after latest sexual misconduct allegation,0
t3_7i0qql,,House rejects Trump impeachment resolution after Dem Rep. Al Green forces vote,0
t3_7i1pfb,,"Sen. Al Franken will resign, Democratic official says",0
t3_7hvc5t,,Lawyers sue California because too many children can't read,0
t3_7hk4yw,,Corporate Dems Don't Rule Out Voting For Republican Tax Plan,0
t3_7hfcgr,,Remind elected members of the Republican Party exactly what they’re standing for when they vote along party lines by sending them a postcard with an infamous Trump quote. Remind them that history has its eyes on them and it will remember. Rightsideofhistory.co,0
t3_7hd8l7,,Black Dems see bias in response to sexual harassment cases,0
t3_7h60sq,,Senate GOP repeals ObamaCare mandate,0
t3_7gkm86,,'African-Americans in Mississippi' Pressured To Vote In Alabama Senate Race - Big League Politics,0
t3_7gbckh,,Why Nancy Pelosi gave a big boost to Roy Moore,0
t3_7fzl2i,,Assemblyman Raul Bocanegra resigns amid sexual misconduct allegations,0
t3_7fdrir,,Nine out of ten economists agree - the Republican tax plan is ridiculous,0
t3_7fbya8,,Poll: Only 22 percent of Minnesotans say Franken should stay in office,0
t3_7f4mi0,,Liberals bail on Bernie Sanders in bid to launch new third party,0
t3_7ews4w,,Two More Women Accuse Sen. Al Franken Of Inappropriate Touching,0
t3_7evfcm,,Stanford Dean Caught On Film Engineering Disruption of Robert Spencer Event,0
t3_7em01n,,Ex-Fox News Employee Says She Was Blocked From Investigating Trump-Russia Ties,0
t3_7edr05,,Democratic Leader Resigns As Sexual Harassment Claims Begin To Surface,0
t3_7drt5j,"There is too much divisiveness in the country today.  Republican,  democrat,  gay,  straight, religious, athiest…  Maybe we just need to realize we are all trying to attack the same problems from different perspectives.  I, as a Republican, want to end poverty and suffering but I think it should be done, on their personal level through giving and outreach.   Others believe that the government should be entrusted to ensure a standard of living for every American.  So there is one thing we can agree on.  My problem is the waste and fraud,  and frankly greed, that is inherent with government.  
     Something that is missing from the Democrat argument of the rich corporations is that corporations do not pay taxes; yes in practice they do, however in reality they simply pass the cost onto the consumers of their product.  The candle is being burned from both ends.
     The current campaign from the Democrat side is for a $15 an hour minimum wage.  On the surface a high minimum wage seems beneficial;  until you realize that all prices across the economy are largely based on labor costs.  Price increases will negate most minimum wage increases and leave many families living in the same conditions.  What will happen however is the middle class that is making over $15 an hour will take a huge hit. 
     We can change things however it has to be a median between all out government, or all out business.
     Together we can make a difference. ",Thoughts.,0
t3_7dpvon,,Hillary Clinton questions 'legitimacy' of Trump's victory in 2016 election,0
t3_7dpufh,,"Tearful Corrine Brown asks court for mercy, compassion Prosecutors want no less than 5 years for former congresswoman",0
t3_7dpsfk,,UW-La Crosse student no longer vice chair of Wisconsin campus Dems after deriding 'white men',0
t3_7dpg5w,,Women On Clinton And Sanders Campaigns Allege Sexual Harassment,0
t3_7ddfah,,"Woman accuses Al Franken of kissing, groping her without consent | TheHill",0
t3_7djis0,,IT Begins Two Prominent Minnesota Democrats Call For Al Franken to Resign,0
t3_7dg5sf,,Hispanic Caucus denies membership to Republican Curbelo,0
t3_7d9c0y,,"Dan Rather On Clinton Rape Allegations: Even If They Turn Out To Be True, It Was A Long Time Ago",0
t3_7cmobn,,"'SNL' Has Special Message From DNC: ""We're Back""",0
t3_7c5fma,,Al Gore Accused of Sexual Assault,0
t3_7bfd1e,,Poll: Views of Democratic Party hit new low,0
t3_7aps91,,Soros Provides Funding to Group Behind Pulled Anti-Gillespie Ad Soros is top funder of Latino Victory; group has been a part of Soros campaigns in 2016,0
t3_7ae575,,Brazile: ‘Proof’ that Clinton rigged nomination process ‘broke my heart’,0
t3_7aajao,,DNC: Straight White Biological Males Need Not Apply for Tech Jobs,0
t3_7a5o7h,,State Attorneys General Lead the Charge Against President Donald Trump,0
t3_7a5dvw,,USDA Forest Service holds open house,0
t3_79s6db,,Witch Hunt Update: FBI Lists 200+ Manafort Transactions from 2006 to 2014 in Indictment – One Year Before Trump Launched Campaign,0
t3_79bph8,"Every other article I've seen since the election is about how white rural Americans felt ""left behind."" And waaaay too many Dems seem to agree. Now, I'm not saying that Dems or pop culture have always treated rural Americans perfectly. I can see how everyone assuming you inbreed can be irritating.

All the same, I wanna call some hard bullshit on this ""left behind rural American"" narrative. They weren't left behind. They got off the bus. Everything they're talking about now, the outsourcing, the lack of infrastructure, the fact that the old jobs are dying, etc. was talked about long LONG before Trump was known for anything but mutilating the NYC skyline.

I hear so many people from rural areas squawking and complaining about how their infrastructure is soooo bad but what have THEY done to fix it? Nothing. Anyone who proposes doing anything about it gets shouted down by the Infowars conspiracy brigades that think ANY public investment (outside of high school football) is part of some grand plan to herd people into FEMA camps or some other junk, the anti-tax whiners, and the people who are opposed to the existence of government in general. Every single time. I've sat in on these council meetings. It's fucking funny. They say they want good infrastructure but the minute it's proposed you gets screams of ""MUH TAXES!"" That's why their infrastructure is crap. Rural America's chickens have come home to roost. You can't neglect your infrastructure for 60 years because you want to keep your precious taxes low and expect it to remain in good shape. Infrastructure costs money.

Low taxes or infrastructure. Choose one.

Outsourcing could have been curtailed too. John Kerry made that a key part of his platform in 2004. But the locals wanted someone ""they could have a beer with."" They were mad about gay marriage (despite none of them being affected in the slightest). They were mad that John Kerry wasn't “manly enough.” Plus, at the time, outsourcing was seen as an urban problem. A problem for ""those people.""

When urbanites, particularly in places like Cleveland and Pittsburgh, were saying ""Hey maybe we should make outsourcing harder,"" in 2003-2004, many people in rural America told us that we should stop being lazy, get off our butts and learn new skills. Stop expecting the government to protect our jobs and revive dying industries they said. Move to where the jobs are. They said that companies should have the freedom to outsource jobs and screw consumers. They were secure in the knowledge that the bad stuff would only happen to the big immoral cities. Outsourcing and corporate corruption (like say, and I'm just using an example from my backyard, an energy company concealing, with the help of the state government, a coal ash spill that contaminated wells and rivers) would never happen in ""God's country.""

And then it did.

And rural America has the audacity to blame ""urban elites."" They say the government doesn't do anything for them but they keep saying that the government is pure evil and should be toothless for anything except fooling around in foreign conflicts. Which is it?

Sorry, as a city dweller, I'm tired of hearing this whole ""rural whites have been ignored"" horse crap. Your entire thing is that you WANT government to be weak and useless. Don't bitch at us city folk when your government can't do anything to help you. You didn't want it to.","I'm soooo tired of this ""left behind rural American"" crap",0
t3_78zxm6,,"In Hill interviews, top Dems denied knowledge of payments to firm behind Trump dossier",0
t3_78ziyb,all dems are libtards 2020 maga,trump 2020 maga,0
t3_78segj,,Judge rejects bid to force Trump to resume Obamacare payments to insurers,0
t3_78l5bx,,Pentagon advocates requiring women to sign up for military draft,0
t3_78k6ij,,"Clinton campaign, DNC paid for research that led to Russia dossier",0
t3_78gfnr,,"Robert Mueller’s widening Russia probe is sweeping up Democrats, including lobbyist Tony Podesta",0
t3_78gcup,,This Is Rich: Democrats Fight To Protect A $1.8 Trillion Tax Break That Benefits The Top 1%,0
t3_78hzju,,Michael Moore’s Broadway Show Falls Short at the Box Office,0
t3_78g9z3,,"Senate Investigates Russia, Hillary Clinton, Obama, Uranium And Bribes — And It's About Time",0
t3_78511c,,Democrats should be terrified by this governor's race,0
t3_77xr18,"The group that went to D.C. and helped saved the ACA and Medicaid (several times) is back. They went to Chicago to get a Dem to stop sponsoring a piece of GOP legislation that would gut the ADA

http://us.blastingnews.com/news/2017/10/adapt-storms-bobby-rushs-office-to-protect-americans-with-disabilities-act-002107609.html",Disability rights group ADAPT goes to Chicago to defend ADA,0
t3_77vqr3,,"Zain Jaffer, CEO Of Startup Vungle, Arrested And Charged With Sexually Abusing His Children",0
t3_77r505,,VIDEO: Students love Trump's tax plan...when told it's Bernie's,0
t3_77ogo0,,Senate Democratic Leader Chuck Schumer (NY) urges Democrats to hide views on gun control because of 2018 elections,0
t3_77me0t,,D.N.C. Chair Purges Dissenters in Surprise Shake-Up,0
t3_77lut7,,Corporate Democrats Purge Bernie Backers From DNC,0
t3_772geo,,Take this survey! Jesus Lord All Mighty We Need More Replies!,0
t3_76fwbm,,From the 'oh no he didnt' file. Letter: Bring NFL diversity figures into parity,0
t3_76a0cv,,USC Rejects $5M Gift From Harvey Weinstein,0
t3_7692ei,,Two ‘Dreamers’ caught smuggling illegal immigrants into U.S.,0
t3_768xyn,,"Pedro Cortes, Pa. secretary of state, steps down",0
t3_762vga,,Obamacare: Trump to halt cost-sharing subsidies to insurers,0
t3_75wn8m,,"Redwood Credit Union teams with Sen. McGuire, Press Democrat to aid fire victims | The Press Democrat",0
t3_75ss4r,,How do you feel about what Malcolm X said about black Democratic voters?,0
t3_74zzc2,,Shifting attitudes among Democrats have big implications for 2020,0
t3_74shud,,"President Donald J. Trump Proclaims October 9, 2017, as Columbus Day",0
t3_74to98,,"Media Give Trump Most Negative Presidential Coverage in 25 Years Only 5 percent of news reports are positive, according to Pew Research Center",0
t3_74kcmn,"I understand why Republicans love Reagan (he was the embodiment of all their values) but why do some Democrats like him? He conflicts with all the views Democrats hold yet the ""Reagan Democrat"" is a pervasive ideology in American politics. Why do you think this is? I believe it is because these Dems are fiscally conservative and socially liberal and feel the Democratic nominee is usually against these ideas. So, what do you think?",Why was Reagan so well loved (by Democrats)?,0
t3_74b3jf,,Black Lives Matter Students Shut Down the ACLU's Campus Free Speech Event Because 'Liberalism Is White Supremacy',0
t3_7470bn,,Obama's top accomplishments,0
t3_744asb,,Petition: Add dislike button to Trump's twitter account,0
t3_744iq6,,"Leftist Teacher Prays Only ""White Trump Supporters"" Died In Las Vegas Shooting",0
t3_73u7a4,,US Marine Risks His Life To Expose Deadly Scandal That Could Take Down Entire Democratic Party,0
t3_73j7v5,,Is Any Part Of The Russia Election Hacking Story True?,0
t3_72z7cb,,Michelle Obama: Women voted for Trump because they were told to like him,0
t3_72o07g,,DirecTV allows some NFL refunds after anthem controversy,0
t3_72nsof,,Trump border wall construction begins,0
t3_72itnb,,Black lawmaker kneels on House floor in solidarity with athletes,0
t3_729149,,O.C. Democrats' big dinner: Too many congressional candidates?,0
t3_724qww,,A Divided Democratic Party Debates Its Future,0
t3_71ts4z,,Insurance rate hike sets record for New Mexico exchange,0
t3_71ta1a,,Dear Colleague: It's over! Education Department rescinds controversial 2011 letter,0
t3_71tvdg,,‘It Undermines Integrity Of Elections’: Glitch Allows Non-U.S. Citizens In Pa. To Vote,0
t3_71pgj3,,"The SPLC Blames Google, Facebook For Dylann Roof Terror — They Didn’t Censor Websites Enough",0
t3_71gj9q,,Philadelphia finds hundreds of illegal voters,0
t3_71dzer,,The Political Genius of Bernie’s ‘Medicare for All’ Bill,0
t3_71enk0,,The FiveThirtyEight Way-Too-Early 2020 Dem Primary,0
t3_71g232,,"These 3 Democrats Think ""Sputnik Radio"" Crushed Hillary's Campaign... But There's A Catch",0
t3_713pxv,,'You're a Liar': Demonstrators Confront Pelosi Over DACA - Demand Automatic Citizenship for All,0
t3_70zxdk,,How Obama's Failure To Prosecute Wall Street Set The Stage For Trump’s Win,0
t3_70uyus,,House Dems break fundraising record with $6.26M August haul.,0
t3_70sbxp,,A March For Black Women On A Jewish Holiday Has Sparked A Fight Within This Feminist Group,0
t3_70k4wc,,LOL. Hillary Holds Book Signing in Costco Milk Aisle – Protesters Scream 'Hillary For Prison!' (VIDEO),0
t3_70fcso,,Facebook doesn't know the full extent of Russia's ad purchases during the 2016 election,0
t3_70evvt,,Police vs. Protesters St. Louis city tonight.,0
t3_7061mf,,WATCH: CNN Celebrity Chef Anthony Bourdain Says He Would Poison POTUS Trump,0
t3_7051hp,,I made a subreddit for moderate and Blue Dog Democrats,0
t3_6zwc1q,,Amazon deletes one-star reviews of Hillary Clinton's new book,0
t3_7006jt,,"Discovery Of Another Democratic ""Secret Server"" May Have Prompted Imran Awan's Firing, Report",0
t3_6zzzge,,How Wall Street became a big chunk of the U.S. economy — and when the Democrats signed on,0
t3_6zqwvt,,"Mike Pence convenes all-white, all-male meeting to plot voter suppression",0
t3_6zqeng,,Mayor Ed Murray resigns after Seattle Times reports new accusations,0
t3_6zoryo,,Texas prof resigns from law firm after tweeting he'd be 'ok' with DeVos sexual assault,0
t3_6zcq3j,,"Hillary Clinton says she’ll never run for office again, could have done ‘better job’ handling America’s anger",0
t3_6z2vab,,'The Guy is Hiding Something': Top Hillary Advisor Suggests Bernie Colluded With Russia During the Primary,0
t3_6yw37w,,What Happened?! — Video Emerges of Hillary Clinton Saying Illegal Immigrant Children Have to Go,0
t3_6yyvrl,,Hillary Clinton fundraiser: 'I wish she'd just shut the f--k up and go away',0
t3_6yyun8,,"Remember This Pic? Well Trump Just Had His Defining ""Umbrella Moment""",0
t3_6yoars,,Police Report Indicates Wasserman Schultz IT Aide Planted Computer For Investigators To Find,0
t3_6yqbvq,,"Voter fraud alert: More than 5,000 New Hampshire presidential voters may not live in state",0
t3_6yky73,,"A Brief List of People Clinton Blames for Her Election Loss, Part 3",0
t3_6yiaw9,,"State officials sound alarm on ObamaCare premium hikes, market 'collapse'",0
t3_6y3cgw,,Trump will end DACA but he is looking for a way to shift the blame to House and Senate so he has told House and Senate leaders they have 6 months to pass an immigration bill or face blame if they can't,0
t3_6xk44n,,Reject the Social Security Commission Act of 2017 – CREDO,0
t3_6xahjq,,Outrageous! White Georgia Cop tells Female Motorist Stopped for DUI: ‘We Only Kill Black People’,0
t3_6x2ghv,,I'm pretty sure this is how they choose mods over /r/conservative. Those mods are dumber than dirt.,0
t3_6wwugm,,Pelosi Statement Condemning Antifa Violence in Berkeley,0
t3_6wvd4g,,"Mattis freezes transgender policy; allows troops to continue serving, pending study",0
t3_6wsz06,,"Antifa violence brings no outrage from Dems, after dire warnings about right-wing violence",0
t3_6wbefs,,Democrat Fundraising Is Worst in a Decade,0
t3_6waw86,,How do you say 'whoops' in Russian? Podesta Group retroactively files more DOJ disclosures for pro-Putin work,0
t3_6w3ztz,,LOL: 'Punch a Nazi' Goes Terribly Wrong When Antifa Moron Realizes Who He Accidentally Decked,0
t3_6vxled,,CNN's Ana Navarro: 'Shameful Nincompoop' Trump Is ‘Unfit to Be Human’,0
t3_6vgrlx,,Antifa recruiter explains why leftists can't be fascists.,0
t3_6v8l3o,,"Antifa Declares: ‘Fuck your Fucking Constitution, We’re Here to Punch Nazis’",0
t3_6v0b3e,,Chief Obamacare Architect Sacked After Fraudulent Billing Investigation,0
t3_6uzk2t,,Hillary Clinton's link to a former KKK leader and senator surfaces again after Charlottesville,0
t3_6uudr3,,Missouri's top Democrats call for senator to resign for 'I hope Trump is assassinated' post,0
t3_6u4myj,,"Next time someone tells you the ACLU is a ""left-wing organization"" show them this video...",0
t3_6u1zr6,,Baltimore Removes Confederate Statues in Overnight Operation,0
